{
  "status": "success",
  "summary": "Detailed UI/UX interaction spec completed for weekly summary and dashboard states.",
  "artifacts": [
    {
      "artifact_id": "art_uiux_spec_001",
      "job_id": "job_20260218_007",
      "stage": "design",
      "agent": "ui_ux_spec_agent",
      "kind": "uiux_spec",
      "uri": "s3://software-factory-artifacts/pulsebudget/design/uiux_spec_weekly_summary_v1.md",
      "sha256": "5555555555555555555555555555555555555555555555555555555555555555",
      "created_at": "2026-02-18T19:08:00Z"
    }
  ],
  "handoff": {
    "next_stage": "implementation",
    "next_agent": "frontend_dev_agent",
    "payload": {
      "spec_uri": "s3://software-factory-artifacts/pulsebudget/design/uiux_spec_weekly_summary_v1.md"
    }
  }
}
